{
  "schema_version": 1,
  "id": "workflow.help_neighbor",
  "name_de": "Nachbarschaftshilfe",
  "implementation_status": "defined",
  "trigger_description_de": "Beobachteter Bedarf und freiwillige Zustimmung",
  "goal_category": "social",
  "steps": [
    {
      "id": "step_1",
      "operation_id": "request_consent",
      "description_de": "Hilfe und Bedingungen vereinbaren"
    },
    {
      "id": "step_2",
      "operation_id": "reserve",
      "description_de": "Zugesagte Mittel reservieren"
    },
    {
      "id": "step_3",
      "operation_id": "assist",
      "description_de": "Teilauftrag leisten"
    },
    {
      "id": "step_4",
      "operation_id": "record_event",
      "description_de": "Erfüllung und Beziehungseffekt speichern"
    }
  ],
  "recipe_ids": [],
  "on_blocked": {
    "release_unstarted_reservations": true,
    "retry_on": [
      "resource_changed",
      "path_changed",
      "rights_changed",
      "assignment_changed"
    ],
    "timeout_game_minutes": 60
  },
  "notes_de": "Geordnete Vorlage, keine ausführbare universelle Skriptsprache. Operationen benötigen explizite C#-Handler. Schlaf-, Reparatur- und Landwirtschaftslogik sind noch nicht implementiert."
}
