{
  "schema_version": 1,
  "id": "workflow.firewood",
  "name_de": "Brennholzvorrat sichern",
  "implementation_status": "defined",
  "trigger_description_de": "Brennholzreichweite unter Ziel",
  "goal_category": "fuel",
  "steps": [
    {
      "id": "step_1",
      "operation_id": "check_rights",
      "description_de": "Entnahmerechte prüfen"
    },
    {
      "id": "step_2",
      "operation_id": "gather",
      "description_de": "Verfügbares Holz beschaffen; Fällen erfordert Werkzeug"
    },
    {
      "id": "step_3",
      "operation_id": "plan_recipe",
      "description_de": "Spalten planen"
    },
    {
      "id": "step_4",
      "operation_id": "reserve",
      "description_de": "Axt und Stamm reservieren"
    },
    {
      "id": "step_5",
      "operation_id": "execute_recipe",
      "description_de": "Brennholz spalten"
    },
    {
      "id": "step_6",
      "operation_id": "store",
      "description_de": "Geschützt einlagern"
    }
  ],
  "recipe_ids": [
    "recipe.split_firewood"
  ],
  "on_blocked": {
    "release_unstarted_reservations": true,
    "retry_on": [
      "resource_changed",
      "path_changed",
      "rights_changed",
      "assignment_changed"
    ],
    "timeout_game_minutes": 60
  },
  "notes_de": "Geordnete Vorlage, keine ausführbare universelle Skriptsprache. Operationen benötigen explizite C#-Handler. Schlaf-, Reparatur- und Landwirtschaftslogik sind noch nicht implementiert."
}
