{
  "schema_version": 1,
  "id": "workflow.visit",
  "name_de": "Bekannte Person besuchen",
  "implementation_status": "defined",
  "trigger_description_de": "Sozialbedarf und freie Zeit",
  "goal_category": "social",
  "steps": [
    {
      "id": "step_1",
      "operation_id": "request_consent",
      "description_de": "Besuch abstimmen"
    },
    {
      "id": "step_2",
      "operation_id": "move",
      "description_de": "Treffpunkt erreichen"
    },
    {
      "id": "step_3",
      "operation_id": "socialize",
      "description_de": "Gemeinsame Zeit verbringen"
    },
    {
      "id": "step_4",
      "operation_id": "record_event",
      "description_de": "Erlebnis und Beziehungseffekt speichern"
    }
  ],
  "recipe_ids": [],
  "on_blocked": {
    "release_unstarted_reservations": true,
    "retry_on": [
      "resource_changed",
      "path_changed",
      "rights_changed",
      "assignment_changed"
    ],
    "timeout_game_minutes": 60
  },
  "notes_de": "Geordnete Vorlage, keine ausführbare universelle Skriptsprache. Operationen benötigen explizite C#-Handler. Schlaf-, Reparatur- und Landwirtschaftslogik sind noch nicht implementiert."
}
